OSSIAM ETF FTSE 100 MIN VAR UCITS 1D,LON:UKMD,05/10/2018 16:30:00,16260,,,,0,17981,15696
OSSIAM FTSE 100 MIN VAR ETF,LON:UKMV,05/10/2018 16:30:00,18194,18194,18194,18194,30,19300,16830
OSSIAM US MIN VAR NR ETF - USD,LON:USMV,05/10/2018 16:30:00,207.83,,,,0,201.95,184.71
OSSIAM WORLD MIN VAR NR ETF ¿USD,LON:WDMV,05/10/2018 16:30:00,183.29,,,,0,189.82,170.39
PIMCO EM ADV LOCAL BOND SOURCE UCITS ETF,LON:EMLB,05/10/2018 16:35:06,91.71,91.71,91.71,91.71,7999,107.22,89.7
PIMCO EM ADV LOCAL BOND SOURCE UCITS ETF,LON:EMLI,05/10/2018 16:30:00,71.93,,,,0,86.88,70.33
PIMCO EM ADV LOCAL BOND SOURCE UCITS ETF,LON:EMLP,05/10/2018 16:30:00,71.54,,,,0,78.26,68.74
PIMCO LOW DUR US CORP BOND SRC UCITS ETF,LON:LDCU,05/10/2018 16:30:00,100.25,100.4,100.4,100.25,1166,103,100.2
PIMCO $ SHORT MATURITY SOURCE UCITS ETF,LON:MINT,05/10/2018 16:35:25,101.53,101.53,101.53,101.52,1909,102.25,101.34
PIMCO £ SHORT MATURITY SOURCE UCITS ETF,LON:QUID,05/10/2018 16:30:00,101.81,101.81,101.81,101.81,288,101.95,101.71
PIMCO SHT TERM HI YLD CORP BOND SRSOURCE,LON:SSHY,05/10/2018 16:30:00,77.31,77.56,77.56,77.31,92,79.83,70.48
PIMCO SHORT HIGH CORP BD UCITS EUR HDG A,LON:STEA,05/10/2018 16:30:00,100.96,,,,0,101.48,98.22
PIMCO SHT TERM HI YLD CORP BOND SRCE ETF,LON:STHE,05/10/2018 16:30:00,90.38,90.38,90.38,90.38,176,94.68,90.19
PIMCO SHT TRM HY CRP BND SRC ETF GBP HDG,LON:STHS,05/10/2018 16:30:00,10.2,10.22,10.22,10.2,2491,10.59,10.16
PIMCO SHT TERM HI YLD CORP BOND SRC ETF,LON:STHY,05/10/2018 16:35:11,101.19,101.26,101.27,101.02,12700,103.38,99.87
PIMCO SHT TERM HI YLD CP BOND SRC ETF AC,LON:STYC,05/10/2018 16:30:00,116.87,116.86,116.87,116.86,440,117.37,111.62
CSOP SOURCE FTSE CHINA A50 UCITS ETF,LON:CHNA,05/10/2018 16:30:00,19.32,,,,0,26.09,17.57
CSOP SOURCE FTSE CHINA A50 UCITS ETF,LON:CHNP,05/10/2018 16:30:00,1500.5,,,,0,1852.5,1380.5
SPDR MSCI EUROPE CONSUMER DIS UCITS ETF,LON:CDIS,05/10/2018 16:30:00,114.78,,,,0,126.66,111.79
SPDR MSCI EUROPE CONSUMER STAPLES ETF,LON:CSTP,05/10/2018 16:30:00,173.9,,,,0,181.96,159.05
SPDR EURO STOXX LOW VOLATILITY UCITS ETF,LON:ELOW,05/10/2018 16:30:00,38.24,38.31,38.31,38.24,260,39.49,36.05
SPDR 0-5 EMERGING MARKET USD GOV BD ETF,LON:EMH5,05/10/2018 16:30:00,29.41,,,,0,30.53,29.15
SPDR MSCI EUR ENGY 35/20 CAP UCITS ETF,LON:ENGY,05/10/2018 16:30:00,151.24,,,,0,152.12,119.45
SPDR MSCI EUROPE UCITS ETF,LON:ERO,05/10/2018 16:30:00,172.06,172.06,172.06,172.06,267,180.04,160.73
SPDR BBARC EURO GOV 3-5 YEAR ETF,LON:EU35,05/10/2018 16:30:00,30.38,,,,0,31.03,30.38
SPDR MSCI EUROPE SMALL CAP UCITS ETF,LON:EUSC,05/10/2018 16:30:00,201.9,201.9,201.9,201.9,1,216.9,194.11
SPDR MSCI EUR SMCAP VALUE WEIGHTED ETF,LON:EUSV,05/10/2018 16:30:00,30.92,30.93,30.94,30.92,1614,33.76,30.35
SPDR MSCI EUROPE VALUE ETF,LON:EVAL,05/10/2018 16:30:00,28.8,28.8,28.8,28.8,50,35.37,28.8
SPDR MSCI EUROPE FINANCIALS UCITS ETF,LON:FNCL,05/10/2018 16:30:00,53.29,53.54,53.54,53.29,2099,61.38,52.34
SPDR GLOBAL CONVERTIBLE BOND UCITS ETF,LON:GCVB,05/10/2018 16:35:04,35.5,35.71,35.71,35.5,2470,225.5,2.64
SPDR MORNINGSTAR GLOB INFRASTRUCTURE ETF,LON:GIN,05/10/2018 16:30:00,24.05,24.05,24.05,24.05,14,25.01,22.02
SPDR GLOBAL CONVERTIBLE BOND UCITS ETF,LON:GLCB,05/10/2018 16:30:00,27.12,27.27,27.27,27.12,2754,36.02,26.97
SPDR S&P US COMM SERV UCITS ETF,LON:GXLC,05/10/2018 16:30:00,15.35,,,,0,15.62,14.88
SPDR MSCI EUROPE HEALTH CARE UCITS ETF,LON:HLTH,05/10/2018 16:30:00,128.6,,,,0,131.16,110.61
SPDR MSCI EUROPE TECHNOLOGY UCITS ETF,LON:ITEC,05/10/2018 16:30:00,70.74,,,,0,76.48,61.78
SPDR EURO STOXX LOW VOLATILITY UCITS ETF,LON:LOWE,05/10/2018 16:30:00,34.76,,,,0,35.7,31.5
SPDR MORNINGSTAR GLOB INFRASTRUCTURE ETF,LON:MAGI,05/10/2018 16:30:00,31.38,,,,0,33.2,30.63
SPDR MSCI EUROPE MATERIALS UCITS ETF,LON:MTRL,05/10/2018 16:30:00,199.28,199.28,199.28,199.28,2,210.54,182.36
SPDR MSCI EUROPE INDUSTRIALS UCITS ETF,LON:NDUS,05/10/2018 16:30:00,171.96,,,,0,176.15,157.72
SPDR RUSSELL 2000 US SMALL CAP ETF,LON:R2SC,05/10/2018 16:30:00,33.93,34.24,34.24,33.93,4125,36.64,28.17
SPDR RUSSELL 2000 US SMALL CAP ETF,LON:R2US,05/10/2018 16:35:00,44.17,44.79,44.79,44.17,58616,47.22,38.61
SPDR 0-5 EMERGING MARKET USD GOV BD ETF,LON:SEMH,05/10/2018 16:30:00,22.47,,,,0,23.26,20.86
SPDR BBARC 0-5 YEAR GBP CORP BOND ETF,LON:SUKC,05/10/2018 16:30:00,30.11,30.1,30.12,30.06,1392,31.26,29.89
SPDR S&P US MATERIALS UCITS ETF,LON:SXLB,05/10/2018 16:30:00,25.39,25.45,25.46,25.39,5639,27.73,24.18
SPDR S&P US COMM SERV UCITS ETF,LON:SXLC,05/10/2018 16:30:00,19.93,,,,0,20.33,19.28
SPDR S&P US ENERGY UCITS ETF,LON:SXLE,05/10/2018 16:30:00,22.76,22.77,22.81,22.71,415212,23.07,19.01
SPDR S&P US FINANCIALS UCITS ETF,LON:SXLF,05/10/2018 16:30:00,29.59,29.64,29.77,29.59,51234,31.51,26.82
SPDR S&P US INDUSTRIALS UCITS ETF,LON:SXLI,05/10/2018 16:30:00,31.13,31,31.14,31,5770,31.29,27.12
SPDR S&P US TECHNOLOGY UCITS ETF,LON:SXLK,05/10/2018 16:30:00,37.03,37.5,37.59,37.03,23509,38.29,29.55
SPDR S&P US CONSUMER STAPLES UCITS ETF,LON:SXLP,05/10/2018 16:30:00,23.94,23.89,23.94,23.85,22410,25.81,21.58
SPDR S&P US UTILITIES UCITS ETF,LON:SXLU,05/10/2018 16:30:00,27.59,27.32,27.59,27.31,11374,28.72,24.03
SPDR S&P US HEALTH CARE UCITS ETF,LON:SXLV,05/10/2018 16:30:00,26.36,26.32,26.48,26.32,26358,26.7,22.02
SPDR S&P US CONSUMER DIS UCITS ETF,LON:SXLY,05/10/2018 16:30:00,30.45,30.59,30.64,30.45,14229,31.95,24.1
SPDR MSCI EUROPE TELECOMM UCITS ETF,LON:TELE,05/10/2018 16:30:00,54.6,,,,0,63.09,53.3
SPDR MSCI USA SMCAP VALUE WEIGHTED ETF,LON:USSC,05/10/2018 16:30:00,38.46,38.57,38.57,38.46,129,40.37,34.38
SPDR MSCI USA VALUE ETF,LON:USVL,05/10/2018 16:30:00,41.35,,,,0,42.18,37.2
SPDR MSCI EUROPE UTILITIES UCITS ETF,LON:UTIL,05/10/2018 16:30:00,100.18,,,,0,103.35,88.01
SPDR MSCI USA VALUE ETF,LON:UVAL,05/10/2018 16:30:00,31.74,31.74,31.74,31.74,133,32.29,26.65
SPDR MSCI WORLD CONS DIS UCITS ETF,LON:WCOD,05/10/2018 16:30:00,41.57,,,,0,42.84,36.08
SPDR MSCI WORLD CONS STAP UCITS ETF,LON:WCOS,05/10/2018 16:30:00,33.1,,,,0,35.24,31.19
SPDR MSCI WORLD SMALL CAP UCITS ETF,LON:WDSC,05/10/2018 16:30:00,74.31,74.35,74.35,74.29,3147,77.44,68.86
SPDR MSCI WORLD FINANCIALS UCITS ETF,LON:WFIN,05/10/2018 16:30:00,41.14,41.01,41.14,41.01,4376,45.92,39.38
SPDR MSCI WORLD HEALTH CARE UCITS ETF,LON:WHEA,05/10/2018 16:30:00,38.96,38.98,38.98,38.96,278,39.75,33.65
SPDR MSCI WORLD MATERIALS UCITS ETF,LON:WMAT,05/10/2018 16:30:00,39.85,39.9,39.91,39.85,436,44.66,38.57
SPDR MSCI WORLD INDUSTRIALS UCITS ETF,LON:WNDU,05/10/2018 16:30:00,41.22,,,,0,42.92,38.07
SPDR MSCI WORLD ENERGY UCITS ETF,LON:WNRG,05/10/2018 16:35:26,38.02,38.21,38.21,37.89,9467,38.62,32.24
SPDR MSCI WORLD SMALL CAP UCITS ETF,LON:WOSC,05/10/2018 16:30:00,56.57,57.03,57.03,56.57,434,60.17,49.91
SPDR MSCI WORLD TECHNOLOGY UCITS ETF,LON:WTEC,05/10/2018 16:30:00,55.73,,,,0,56.74,44.07
SPDR MSCI WORLD TELECOMMS UCITS ETF,LON:WTEL,05/10/2018 16:30:00,30.39,30.34,30.39,30.34,5572,32.26,28.69
SPDR MSCI WORLD UTILITIES UCITS ETF,LON:WUTI,05/10/2018 16:30:00,33.68,,,,0,35.14,30.87
SPDR MSCI ACWI UCITS ETF $,LON:ACWD,05/10/2018 16:30:00,130.62,131.23,131.23,130.62,3593,137.44,121.67
SPDR MSCI ACWI UCITS ETF,LON:ACWI,05/10/2018 16:30:00,99.88,100.66,100.66,99.88,993,103.12,87.92
SPDR S&P PAN ASIA DIVIDEND UCITS ETF,LON:ASDV,05/10/2018 16:30:00,44.89,45.07,45.07,44.89,20908,50.95,44.89
SPDR BBARC 3-7 EURO CORP UCITS ETF,LON:EC37,05/10/2018 16:30:00,30.92,,,,0,31.62,30.92
SPDR S&P EMERGING MARKETS DVD UCIT ETF $,LON:EDVD,05/10/2018 16:30:00,15.19,15.23,15.23,15.19,10067,18.85,14.99
SPDR MSCI EM ASIA UCITS ETF $,LON:EMAD,05/10/2018 16:30:00,60.68,60.99,60.99,60.6,2572,75.8,60.6
SPDR MSCI EM ASIA UCITS ETF,LON:EMAS,05/10/2018 16:30:00,46.55,46.55,46.55,46.55,835,53.69,46.55
SPDR EMERGING MARKETS CORPORATE BOND ETF,LON:EMCB,05/10/2018 16:30:00,72.25,72.25,72.25,72.25,105,76.3,67.5
SPDR EMERGING MARKETS CORPORATE BOND ETF,LON:EMCO,05/10/2018 16:30:00,94.17,94.05,94.17,94.05,217,101.2,93.65
SPDR BBARC EM LOCAL BOND UCITS $,LON:EMDD,05/10/2018 16:30:00,66.57,66.63,66.83,66.55,2032,79.68,65.47
SPDR BBARC EM LOCAL BOND UCITS,LON:EMDL,05/10/2018 16:30:00,51.17,51.09,51.17,51.02,86713,57.31,50.27
SPDR S&P EMERGING MARKETS DVDND UCIT ETF,LON:EMDV,05/10/2018 16:30:00,11.62,11.64,11.64,11.62,4096,13.28,11.42
SPDR EM INFLATION LINKED BOND UCITS ETF,LON:EMIL,05/10/2018 16:30:00,58.38,58.38,58.38,58.38,300,72.6,56.07
SPDR EM INFLATION LINKED BOND UCITS ETF,LON:EMIN,05/10/2018 16:30:00,44.95,,,,0,52.99,43.19
SPDR MSCI EMERGING MARKETS UCITS ETF $,LON:EMRD,05/10/2018 16:30:00,50.95,51.21,51.23,50.95,6423,64.36,50.95
SPDR MSCI EMERGING MARKETS UCITS ETF,LON:EMRG,05/10/2018 16:30:00,39.08,39.08,39.08,39.08,250,45.48,39.01
SPDR MSCI EMRG MRKTS SM CAP UCITS ETF $,LON:EMSD,05/10/2018 16:30:00,75.43,,,,0,94.21,76.38
SPDR MSCI EMERGING MARKETS SMALL CAP ETF,LON:EMSM,05/10/2018 16:30:00,57,57.44,57.44,57,675,67.64,57
SPDR MSCI EMU UCITS ETF £,LON:EMUE,05/10/2018 16:30:00,42.49,42.49,42.49,42.49,1081,45.32,40.52
SPDR BBARC 1-3 YR EURO GOV UCITS ETF,LON:EU13,05/10/2018 16:30:00,52.12,,,,0,52.67,51.94
SPDR BBARC 5-7 EURO GOV BD UCITS ETF,LON:EU57,05/10/2018 16:30:00,30.01,,,,0,30.7,29.74
SPDR BBARC 7-10 EURO GOV BD UCITS ETF,LON:EU7L,05/10/2018 16:30:00,30.46,,,,0,31.05,30.1
SPDR BBARC EURO AGG BOND UCITS ETF,LON:EUAG,05/10/2018 16:30:00,59.4,,,,0,61.59,59.23
SPDR BBARC  EURO CORP BOND UCITS ETF,LON:EUCO,05/10/2018 16:30:00,56.93,,,,0,58.25,56.72
SPDR S&P EURO DIVIDEND ARISTOCRATS ETF,LON:EUDI,05/10/2018 16:30:00,22.34,22.34,22.34,22.34,341,24.28,21.79
SPDR S&P EURO DIVIDEND ARISTOCRATS ETF£,LON:EUDV,05/10/2018 16:30:00,19.59,19.69,19.78,19.58,3846,21.76,19.04
SPDR FTSE EPRA EUR EX UK RE,LON:EURE,05/10/2018 16:30:00,29.64,29.64,29.64,29.64,23,32.07,27.29
SPDR FTSE EPRA EUR EX UK RE,LON:EURL,05/10/2018 16:30:00,25.76,25.76,25.76,25.76,89,28.75,23.93
SPDR MSCI EMU UCITS ETF,LON:EURO,05/10/2018 16:30:00,49.34,,,,0,51.61,46.3
SPDR FTSE UK ALL SHARES UCITS ETF (DIST),LON:FTAD,05/10/2018 16:30:00,5,,,,0,5.34,4.97
SPDR FTSE UK ALL-SHARE UCITS ETF,LON:FTAL,05/10/2018 16:35:19,50.43,50.88,50.88,50.03,7302,51.71,46.09
SPDR S&P GLOBAL DIVIDEND UCITS ETF,LON:GBDV,05/10/2018 16:30:00,25.58,25.61,25.65,25.53,5011,26.57,23.74
SPDR DOW JONES GLOBAL REAL EST UCITS ETF,LON:GBRE,05/10/2018 16:30:00,26.54,26.54,26.54,26.54,268,28.74,23.78
SPDR BBARC GBL AGG £HDG UCITS ETF,LON:GLAB,05/10/2018 16:30:00,29.87,,,,0,30.32,29.84
SPDR BARC BLOOM GLOBAL AGG UCITS ETF,LON:GLAG,05/10/2018 16:30:00,28.77,,,,0,30.03,28.77
SPDR BBARC GBL AGG $HDG UCITS ETF,LON:GLAU,05/10/2018 16:30:00,30.21,,,,0,30.58,30.09
SPDR BARC BLOOM GLOBAL AGG UCITS ETF,LON:GLBL,05/10/2018 16:30:00,21.9,,,,0,22.59,21.02
SPDR S&P GLOBAL DIVIDEND UCITS ETF,LON:GLDV,05/10/2018 16:30:00,33.36,33.38,33.5,33.36,5646,36.94,32.96
SPDR DOW JONES GLOBAL REAL EST UCITS ETF,LON:GLRE,05/10/2018 16:30:00,34.62,34.63,34.65,34.62,1016,37.07,33.56
SPDR BBARC  15+ YEAR GILT UCITS ETF,LON:GLTL,05/10/2018 16:30:00,61.66,61.81,61.82,61.61,2174,67.43,61.21
SPDR BBARC 1-5 YEAR GILT UCITS ETF,LON:GLTS,05/10/2018 16:30:00,50.54,50.57,50.64,50.53,12298,51.72,50.37
SPDR BBARC UK GILT UCITS ET,LON:GLTY,05/10/2018 16:30:00,55.16,55.1,55.3,55.1,2230,58.03,54.98
SPDR BBARC EURO GOV BOND UCITS ETF,LON:GOVY,05/10/2018 16:30:00,60.78,60.78,60.78,60.78,85,62.92,60.78
SPDR MSCI ACWI IMI UCITS ETF $,LON:IMID,05/10/2018 16:30:00,137.04,,,,0,142.73,127.21
SPDR BBARC 3-10 US CORP BD UCITS ETF,LON:IUCB,05/10/2018 16:30:00,29.69,,,,0,31.45,29.7
SPDR BBARC EURO HY BOND UCITS,LON:JNKE,05/10/2018 16:35:00,57.01,56.95,57.01,56.95,185,80.74,56.44
SPDR BBARC 0-5 YR US HIGH YIELD BOND,LON:JNKS,05/10/2018 16:30:00,35.58,35.75,35.84,35.58,2220,36.57,32.57
DR MSCI JAPAN EUR HDG UCITS ETF,LON:JPEH,05/10/2018 16:30:00,39.19,,,,0,40.96,35.29
SPDR MSCI JAPAN UCITS ETF,LON:JPJP,05/10/2018 16:30:00,34.43,,,,0,35.86,31.62
SPDR BBARC  10+ US CORP BD UCITS ETF,LON:LCRP,05/10/2018 16:30:00,23.19,,,,0,25.37,22.03
SPDR BBARC 10+ EURO GOV BD UCITS ETF,LON:LGOV,05/10/2018 16:30:00,30.36,,,,0,30.94,29.43
SPDR S&P 500 LOW VOLATILITY UCITS ETF,LON:LOWV,05/10/2018 16:30:00,49.53,,,,0,49.98,44.58
SPDR BBARC  10+ US CORP BD UCITS ETF,LON:LUSC,05/10/2018 16:30:00,30.72,,,,0,33.85,30.72
SPDR BBARC 10+ US TRSY BD UCITS ETF,LON:LUTR,05/10/2018 16:30:00,26.43,,,,0,29.89,26.67
SPDR S&P PAN ASIA DIVIDEND UCITS ETF,LON:PADV,05/10/2018 16:30:00,34.45,34.44,34.47,34.44,9170,37.35,33.15
SPDR BBARC  0-3 EURO CORPORATE BOND,LON:SEUC,05/10/2018 16:30:00,30.23,,,,0,30.4,30
SPDR BBARC 0-5 YR US HIGH YIELD BOND,LON:SJNK,05/10/2018 16:30:00,46.54,46.54,46.54,46.54,25,48.16,45.83
SPDR S&P 500 UCITS ETF,LON:SPX5,05/10/2018 16:30:00,220.8,222.55,222.64,220.8,3322,227.32,182.5
SPDR S&P 400 US MID CAP UCITS ETF,LON:SPY4,05/10/2018 16:35:20,56.88,57.23,57.27,56.8,27351,57.27,44.75
SPDR S&P 500 UCITS ETF,LON:SPY5,05/10/2018 16:30:00,290.01,290.75,291.09,289.74,6806,295.09,253.94
SPDR BBARC 0-3 US CORPORATE BOND,LON:SUSC,05/10/2018 16:30:00,49.67,49.67,49.67,49.67,1486,50.54,49.21
SPDR BBARC  0-3 US CORPORATE BOND,LON:SUSD,05/10/2018 16:30:00,38.02,38.02,38.02,38.02,101,39.14,34.72
SPDR BBARC US TIPS UCITS ETF,LON:TIPS,05/10/2018 16:30:00,29.61,29.72,29.72,29.51,11111,31.09,29.51
SPDR BBARC 1-3 US TREASURY BOND,LON:TRS3,05/10/2018 16:30:00,49.1,,,,0,49.95,48.9
SPDR BBARC 3-5 US TRSY BD UCITS ETF,LON:TRS5,05/10/2018 16:30:00,28.74,,,,0,29.66,28.61
SPDR BBARC 5-7 US TRSY BD UCITS ETF,LON:TRS7,05/10/2018 16:30:00,28.46,,,,0,29.53,28.14
SPDR BBARC 7-10 US TRSY BD UCITS ETF,LON:TRSX,05/10/2018 16:30:00,27.69,,,,0,29.24,27.41
SPDR BBARC US TREAS BOND ETF,LON:TRSY,05/10/2018 16:35:04,101.64,101.71,101.79,101.64,15823,106.54,101.64
SPDR BBARC 1-3 US TREASURY BOND,LON:TSY3,05/10/2018 16:30:00,37.53,37.56,37.56,37.53,2786,38.75,34.47
SPDR S&P US DIVIDEND ARISTOCRATS ETF $,LON:UDVD,05/10/2018 16:35:20,53.82,53.9,53.92,53.78,15355,55.49,48.82
SPDR BBARC STERLING CORP BOND UCITS ETF,LON:UKCO,05/10/2018 16:30:00,58.03,58.27,58.34,58.03,7564,62.06,58.03
SPDR S&P UK DIVIDEND ARISTOCRAT UCIT ETF,LON:UKDV,05/10/2018 16:30:00,11.32,11.3,11.42,11.28,21421,12.74,10.63
SPDR BBARC US AGG BOND UCITS ETF,LON:USAG,05/10/2018 16:30:00,101.68,,,,0,107.1,101.71
SPDR BBARC  US CORP BD UCITS ETF,LON:USCB,05/10/2018 16:30:00,23.72,,,,0,24.47,21.64
SPDR BBARC US CORP BD UCITS ETF,LON:USCO,05/10/2018 16:30:00,30.36,,,,0,32.15,30.21
SPDR S&P US DIVIDEND ARISTOCRATS UCITETF,LON:USDV,05/10/2018 16:30:00,41.24,41.32,41.32,41.18,8451,42.73,34.72
SPDR S&P 500 LOW VOLATILITY UCITS ETF,LON:USLV,05/10/2018 16:30:00,38.2,,,,0,39.23,32.22
SPDR BBARC  US TREAS BOND ETF,LON:USTY,05/10/2018 16:30:00,77.71,78.12,78.12,77.7,2546,81.47,72.35
SPDR BBARC US TIPS UCITS ETF,LON:UTIP,05/10/2018 16:30:00,22.56,22.68,22.69,22.56,9379,23.8,21.26
UBSETF BLM BARC MSCI EUR.AR.LIQ.C.EUR,LON:CBSE,05/10/2018 16:30:00,1224,,,,0,1275,1206
UBSETF BG BAR US LIQ CORP IR-HD USD ADIS,LON:CUIH,05/10/2018 16:30:00,1063,,,,0,1067,982.75
UBSETF FACTOR EMU LOW VOL. H. GBP A-DIS,LON:ELOV,05/10/2018 16:30:00,921,,,,0,1126.3,921
UBSETF FACTOR EMU PRIME V. H. GBP A-DIS,LON:EPVL,05/10/2018 16:30:00,1092,,,,0,1204.6,1073.8
UBSETF FACTOR EMU QUALITY H. GBP A-DIS,LON:EQLT,05/10/2018 16:30:00,1128,,,,0,1145.75,1038.1
UBSETF FACTOR EMU TS YIELD H. GBP A-DIS,LON:ETSY,05/10/2018 16:30:00,1004.2,,,,0,1116.75,908
UBS ETF EMU SEL FAC MIX EUR ACC,LON:EUFM,05/10/2018 16:30:00,840.3,,,,0,840.3,816.75
UBSETF MSCI JAPAN SOC. RESPON. JPY A-DIS,LON:JPSR,05/10/2018 16:30:00,1724,1728,1728,1724,506,1769.5,1538.75
UBSETF BLM BARC USD EMMA SOVER GBP A-DIS,LON:SBEG,05/10/2018 16:30:00,1097,,,,0,1243.5,1086
UBSETF BLM BARC USD EMMA SOVER USD A-DIS,LON:SBEM,05/10/2018 16:30:00,856.5,,,,0,924.75,814.13
UBSETF JPM USD EM DIV BOND 1-5 USD ADIS,LON:SEMC,05/10/2018 16:30:00,946.5,,,,0,964,912
UBS ETF - EURO STOXX 50 A-DIS,LON:UB00,05/10/2018 16:30:00,35.07,,,,0,36.81,32.71
UBS ETF EURO STOXX 50 (EUR) A-DIS,LON:UB01,05/10/2018 16:30:00,3033.5,,,,0,3274.5,2854.75
UBS ETF MSCI JAPAN (JPY) A-DIS,LON:UB02,05/10/2018 16:30:00,3597,3597,3597,3597,8000,3699,3262
UBS ETF FTSE 100 (GBP) A-DIS,LON:UB03,05/10/2018 16:30:00,6843,6833,6843,6833,1800,7286,6411
UBS ETF MSCI EMU (EUR) A-DIS,LON:UB06,05/10/2018 16:30:00,10536,10588,10588,10536,2279,11530,10268
UBSETF MSCI JAPAN HGBP A-ACC,LON:UB0C,05/10/2018 16:30:00,1271.5,,,,0,1298.5,1120.75
UBSETF MSCI JAPAN HGBP A-DIS,LON:UB0D,05/10/2018 16:30:00,1219.5,1223.5,1225,1219.5,3349,1299,1115
UBSETF MSCI EMU HGBP A-ACC,LON:UB0E,05/10/2018 16:30:00,1024.8,1021,1024.8,1021,1526,1097,975.2
UBSETF MSCI EMU HGBP A-DIS,LON:UB0F,05/10/2018 16:30:00,995.8,1001,1001,994.3,5105,1081.08,972
UBS ETF MSCI EUROPE (EUR) A-DIS,LON:UB12,05/10/2018 16:30:00,5618,,,,0,5854,5215.5
UBS ETF MSCI EMU VALUE (EUR) A-DIS,LON:UB17,05/10/2018 16:30:00,3279,3300,3300,3279,451,3750,3255
UBS ETF MSCI PACIFIC (EX JAPAN) (USD) A,LON:UB20,05/10/2018 16:30:00,3168,3168,3168,3168,6,3454.5,3062
UBS ETF MSCI CANADA (CAD) A-DIS,LON:UB23,05/10/2018 16:30:00,2435,2435,2435,2435,2000,2532.13,2121.5
UBS ETF - MSCI EMERGING MARKETSA-DIS,LON:UB30,05/10/2018 16:30:00,99.3,99.3,99.3,99.3,74,126.42,99.17
UBS ETF MSCI EMERGING MARKETS (USD)A-DIS,LON:UB32,05/10/2018 16:30:00,7577,7578,7578,7577,9,8929.5,7563
UBS ETF MSCI EMU SOCIALLY RESP UCITS,LON:UB39,05/10/2018 16:30:00,8124,8150,8150,8124,97,8604,7649.5
UBS ETF MSCI PACIFIC SOCIALLY RESPONSIBA,LON:UB45,05/10/2018 16:30:00,5405,5405,5405,5405,26,5653.6,4992
UBS ETF MSCI EMU SMALL CAP (EUR) A-DIS,LON:UB69,05/10/2018 16:30:00,8440,8470,8511,8440,278,9481.5,8440
UBS ETF BLM BARC US 1-3 YEAR TREASURY BD,LON:UB74,05/10/2018 16:30:00,1864,,,,0,1933.75,1718
UBS ETF BLM BARC US 7-10YEAR TREASURY BD,LON:UB82,05/10/2018 16:30:00,2977,,,,0,3237,2839
UBS ETF MARKIT IBOXX E GERMANY 1-3 (EUR),LON:UB89,05/10/2018 16:30:00,6964.42,,,,0,7123,6779
UBS ETF MARKIT IBOXX E LIQUID CORPORATES,LON:UB99,05/10/2018 16:30:00,8954,,,,0,9222,8759
UBSETF MSCI EUROPE HGBP A-ACC,LON:UBEU,05/10/2018 16:30:00,1188,,,,0,1232.3,1107.4
UBSETF BG BAR EUR INFL LNK 1-10 EUR ADIS,LON:UBIF,05/10/2018 16:30:00,1298,,,,0,1332,1290.5
UBSETF BLM BARC TIPS 10+ USD A-DIS,LON:UBTL,05/10/2018 16:30:00,990,,,,0,1042,921.5
UBSETF BLM BARC TIPS1-10 HD GBP A-ACC,LON:UBTP,05/10/2018 16:30:00,1291.5,,,,0,1316.5,1290.5
UBSETF BLM BARC TIPS1-10 USD A-DIS,LON:UBTS,05/10/2018 16:30:00,918.75,,,,0,944.38,843.88
UBS ETF JPM USD EM DIV 1-5GD,LON:UBXX,05/10/2018 16:30:00,1230,,,,0,1255,1225
UBS ETF MSCI WORLD SOCIALLY RESPONSIBLEA,LON:UC44,05/10/2018 16:30:00,7253.8,7253.8,7253.8,7253.8,265,7422.47,6287.5
UBS ETF MSCI USA SOCIALLY RESP UCITS,LON:UC46,05/10/2018 16:30:00,8849,8900,8903,8849,8566,9040.1,7417
UBS ETF MSCI WORLD (USD) A-DIS,LON:UC55,05/10/2018 16:30:00,16461,16461,16461,16461,4,16842,14350.5
UBS ETF-MSCI UNITED KINGDOM A-DIS,LON:UC63,05/10/2018 16:30:00,1893,,,,0,1990,1758
UBS ETF-MSCI UNITED KINGDOM A-ACC,LON:UC64,05/10/2018 16:35:07,2285.5,2305,2305,2285.5,2693,2361,2101
UBS ETF - MSCI JAPAN UCITS ETF(JPY)A-DIS,LON:UC65,05/10/2018 16:30:00,47.07,47.07,47.07,47.07,4000,51.38,44.24
UBS ETF - MSCI USA UCITS ETF (USD) A-DIS,LON:UC67,05/10/2018 16:30:00,279.16,279.16,279.16,279.16,1126,281.68,244.4
UBS ETF - MSCI WORLD UCITS ETF(USD)A-DIS,LON:UC68,05/10/2018 16:30:00,218.55,,,,0,225.15,200.96
UBS ETF BLM BARC US LIQUID CRP USD A-DIS,LON:UC76,05/10/2018 16:30:00,15.81,,,,0,16.87,15.73
UBS ETF MSCI EM SOCIALLY RESP USD A-DIS,LON:UC79,05/10/2018 16:30:00,993.75,,,,0,1136,975
UBSETF BLM BARC US LIQ CRP 1-5 USD A-DIS,LON:UC81,05/10/2018 16:30:00,1065.5,,,,0,1107.5,984
UBSETF BLM BARC US LIQ CRP 1-5 HD TO GBP,LON:UC82,05/10/2018 16:30:00,1376.5,1376.5,1376.5,1376.5,420,1444.7,1373.5
UBS ETF BLM BARC US LIQUID CRP USD A-DIS,LON:UC84,05/10/2018 16:30:00,1209.5,,,,0,1281.75,1121.5
UBS ETF BLM BARC US LIQ CRP HD TO GBP AD,LON:UC85,05/10/2018 16:30:00,1592.5,,,,0,1719,1587.57
UBSETF BLM BARC US LIQ CRP 1-5 USD A-DIS,LON:UC86,05/10/2018 16:30:00,14.02,14.02,14.02,14.02,9755,14.47,13.89
UBSETF MSCI CANADA HDG TO GBP A-ACC,LON:UC87,05/10/2018 16:30:00,1343.5,1343.5,1343.5,1343.5,225,1384,1244
UBSETF MSCI EMU HDG TO USD A-DIS,LON:UC89,05/10/2018 16:30:00,24.41,,,,0,26.33,23.82
UBSETF MSCI SWITZERLAND HDG TO GBP A-ACC,LON:UC93,05/10/2018 16:30:00,1649.5,,,,0,1680.23,1505
UBSETF MSCI SWITZERLAND HDG TO GBP A-DIS,LON:UC94,05/10/2018 16:30:00,1559,1559,1559,1559,10000,1624.25,1449
UBSETF BLM BARC US LIQ CRP SUS USD A-DIS,LON:UC97,05/10/2018 16:30:00,15.89,,,,0,16.75,15.85
UBSETF BLM BARC US LIQ CRP SUS USD A-DIS,LON:UC98,05/10/2018 16:30:00,1210,1217,1217,1210,346,1275,1126.5
UBSETF FACTOR M. EMU LOW VOL. EUR A-DIS,LON:UD02,05/10/2018 16:30:00,1321,,,,0,1349.6,1232.7
UBSETF FACTOR EMU PRIME VAL. EUR A-DIS,LON:UD03,05/10/2018 16:30:00,1431,,,,0,1591.6,1386.8
UBSETF FACTOR EMU QUALITY EUR A-DIS,LON:UD04,05/10/2018 16:30:00,1670,,,,0,1706.25,1519.35
UBSETF FACTOR EMU T. S. YIELD EUR A-DIS,LON:UD05,05/10/2018 16:30:00,1435,,,,0,1577,1385.1
UBSETF BLOOMBERG COMMODITY CMCI A-DIS,LON:BCCU,05/10/2018 16:30:00,10.16,,,,0,11.19,10.06
UBSETF CMCI EX-AGRICULTURE USD,LON:CXAP,05/10/2018 16:30:00,10854,10854,10854,10854,2500,11038,9545
UBSETF CMCI EX-AGRICULTURE USD,LON:CXAU,05/10/2018 16:30:00,142.62,142.62,142.62,142.62,35,183.68,125.83
UBS ETFS PLC - CMCI COMPOSITE SF USD A,LON:UC14,05/10/2018 16:30:00,65.45,,,,0,70.14,61
UBS ETFS PLC - CMCI COMPOSITE SF USD A,LON:UC15,05/10/2018 16:35:24,5123,5145,5160,5123,2894,5248,4618
UBSETF MSCI AC ASIA EX JAPAN A-ACC,LON:UC48,05/10/2018 16:30:00,11128,,,,0,11959,10570
UBSETF CMCI COMPOSITE GBP A-ACC,LON:UC90,05/10/2018 16:30:00,9381,9383,9401,9377,6918,9865,8729
UBS ETF BB COMMODITY CMCI HDG TO GBP A-A,LON:UD06,05/10/2018 16:30:00,973.8,,,,0,1035.4,973.8
UBS ETF BB COMMODITY CMCI USD A-A,LON:UD07,05/10/2018 16:30:00,800.3,,,,0,800.3,748.2
UBS ETF CMCI EX AGRICULTURE HDG GBP A-A,LON:UD08,05/10/2018 16:30:00,10632,,,,0,10848,9732
UBSETF MSCI AUSTRALIA AUD A-DIS,LON:AUAD,05/10/2018 16:30:00,1667.5,,,,0,1683,1435.25
UBSETF AUSTRALIA HEDG. TO GBP A-ACC,LON:AUGA,05/10/2018 16:30:00,1460,,,,0,1503.75,1317.25
UBS ETF ACWI SRI HDG GBP DIS,LON:AWSG,05/10/2018 16:30:00,980.4,,,,0,995.6,903.95
UBS ETF ACWI SRI HDG USD ACC,LON:AWSR,05/10/2018 16:30:00,0,,,,0,9.72,9.14
UBS (IRL) ETF GL GEN EQ USD ACC,LON:GENE,05/10/2018 16:30:00,941.6,,,,0,952.1,898.45
UBS (IRL) ETF GL GEN EQ HDG GPB ACC,LON:GENG,05/10/2018 16:30:00,1301.2,,,,0,1312.8,1265.3
UBSETF MSCI USA HD GBP A-ACC,LON:UB0A,05/10/2018 16:30:00,1222.45,1222.3,1222.45,1222.3,9793,1237.19,17.38
UBSETF MSCI USA HD GBP A-DIS,LON:UB0B,05/10/2018 16:30:00,1203.85,1203.85,1203.85,1203.85,2000,1219.5,1074.75
UBS ETF - MSCI USA A-DIS,LON:UC03,05/10/2018 16:30:00,70.36,,,,0,71.08,61.63
UBS ETF-MSCI USA (USD)A-DIS,LON:UC04,05/10/2018 16:30:00,5364,,,,0,4957.5,4442
UBS ETF-MSCI USA VALUE(USD)A-DIS,LON:UC07,05/10/2018 16:30:00,5931,5962,5962,5931,2004,6015,5051.65
UBS ETF-S&P 500(USD)A-DIS,LON:UC13,05/10/2018 16:30:00,3575,3575,3575,3575,1576,3626,2953
UBSETF FACTOR M. USA LOW VOL. USD A-DIS,LON:UC95,05/10/2018 16:30:00,1580,1580,1580,1580,3,1580,1333
UBSETF FACTOR USA PRIME VALUE USD A-DIS,LON:UC96,05/10/2018 16:30:00,1482.18,,,,0,1721.25,1405.5
UBSETF FACTOR USA QUALITY USD A-DIS,LON:UC99,05/10/2018 16:30:00,1810,,,,0,1855.75,1504.5
UBSETF FACTOR USA T. S. YIELD USD A-DIS,LON:UD01,05/10/2018 16:30:00,1589,,,,0,1730.75,1438.5
UBS ETF MSCI UK SRI A-DIS,LON:UKSR,05/10/2018 16:30:00,1557.4,1570.6,1570.6,1557.4,3521,1710.6,1512
UBSETF FACTOR USA LOW VOL. H. GBP A-DIS,LON:ULOV,05/10/2018 16:30:00,1296,,,,0,1308.5,1185.5
UBSETF FACTOR USA PRIME V. H. GBP A-DIS,LON:UPVL,05/10/2018 16:35:18,1165.5,1165.5,1165.5,1165.5,850,1198.5,1031.5
UBSETF FACTOR USA QUALITY H. GBP A-DIS,LON:UQLT,05/10/2018 16:30:00,1504.5,,,,0,1511,1282.75
UBSETF MSCI US SEL FACTOR MIX USD A-DIS,LON:USFM,05/10/2018 16:30:00,1509,,,,0,1522.75,1242
UBSETF S&P 500 GBP HD A-DIS,LON:USPG,05/10/2018 16:30:00,1582,1582,1582,1582,66,1604,1414.5
UBSETF FACTOR USA TS YIELD H. GBP A-DIS,LON:UTSY,05/10/2018 16:30:00,981.5,,,,0,1149,981.5
UBS ETF WRLD SEL FAC MIX USD DIS,LON:WOFM,05/10/2018 16:30:00,938.3,,,,0,938.3,907.35
VANECK VECTORS JPM EM LOC CUR BD ETF,LON:EMGB,05/10/2018 16:30:00,43,,,,0,49.05,43
VANECK VECTORS JPM EM LOC CUR BD ETF,LON:EMLC,05/10/2018 16:30:00,57.47,,,,0,67.35,54.5
VANECK VECTORS GOLD MINERS A SHARES,LON:GDGB,05/10/2018 16:30:00,15.22,,,,0,18.81,14.07
VANECK VECTORS GLOBAL MINING UCITS ETF,LON:GDIG,05/10/2018 16:30:00,17.83,,,,0,19.9,16.48
VANECK VECTORS GOLD MINERS A SHARES,LON:GDX,05/10/2018 16:30:00,19.65,19.74,19.78,19.65,11210,26,18.08
VANECK VECTORS JNR GOLD MINERS A SHARES,LON:GDXJ,05/10/2018 16:30:00,23.17,23.34,23.4,23.17,3006,30.26,21.64
VE VECTORS GLOBAL FALLEN ANGEL HY BOND,LON:GFA,05/10/2018 16:30:00,49.78,,,,0,50.25,49.22
VE VECTORS GLOBAL FALLEN ANGEL HY BOND,LON:GFGB,05/10/2018 16:30:00,37.92,,,,0,37.92,35.19
VANECK VECTORS GLOBAL MINING UCITS ETF,LON:GIGB,05/10/2018 16:30:00,12.57,,,,0,14.53,12.57
VANECK VECTORS JNR GOLD MINERS A SHARES,LON:GJGB,05/10/2018 16:30:00,18.08,,,,0,22.41,16.77
VAN ECK NAT RESOURCES A SHARES,LON:HAGB,05/10/2018 16:30:00,0,,,,0,15.46,14.55
VAN ECK NATURAL RES A SHARES,LON:HAP,05/10/2018 16:30:00,21.95,,,,0,21.95,20.09
VE VECTORS EMERGING MARKETS HY BOND,LON:HYEM,05/10/2018 16:30:00,99.6,,,,0,100.58,96.04
VE VECTORS EMERGING MARKETS HY BOND,LON:HYGB,05/10/2018 16:30:00,74.38,,,,0,74.68,70.32
VANECK V MORNINGSTAR US WIDE MOAT UCTIS,LON:MOAT,05/10/2018 16:30:00,32.52,32.64,32.65,32.52,1399,33.27,27.89
VANECK V MORNINGSTAR US WIDE MOAT UCTIS,LON:MOGB,05/10/2018 16:30:00,24.87,24.87,24.87,24.87,996,25.34,20.11
VAN ECK PREFERRED US EQ A SHARES,LON:PRF,05/10/2018 16:30:00,19.36,19.32,19.36,19.32,1974,20.22,19.2
VAN ECK PRE US EQUITY A SHARES,LON:PRGB,05/10/2018 16:30:00,14.77,14.75,14.77,14.75,1974,15.75,13.66
VANGUARD FTSE DEV ASIAPAC XJPN UCITS ETF,LON:VAPX,05/10/2018 16:35:18,18.61,18.81,18.81,18.61,17407,20.9,18.61
VANGUARD USD CORPORATE BOND UCITS ETF,LON:VDCP,05/10/2018 16:30:00,50.3,50.35,50.35,50.3,360,53.54,50.3
VANGUARD FTSE EMERGING MARKETS UCITS ETF,LON:VDEM,05/10/2018 16:30:00,53.3,53.82,53.82,53.21,56308,68.76,53.21
VANGUARD USD EM GOV'T BOND UCITS ETF,LON:VDET,05/10/2018 16:30:00,48.75,,,,0,52.69,48.36
